{
  "schema_version": "1.0.0",
  "run": {
    "run_id": "run_01JB9Z6QK3EXAMPLE",
    "content_sha256": "9952847281c66a65d73250e2019a4505087db4949ed2f7e0f2200fe5f53cd9a9",
    "idempotency_key": "db9dafd10ee54e134b48820a8fb8ebdcef1d7b063bdeb88379bb195c3cbacad0",
    "started_at": "2026-09-21T10:14:02Z",
    "completed_at": "2026-09-21T10:14:19Z",
    "model_id": "openrouter/gpt-5.6-luna",
    "model_params": {
      "temperature": 0,
      "top_p": 1,
      "seed": 7,
      "response_format": "json_schema"
    },
    "prompt_version": "eoc-supplemental-v3",
    "domain_packs": [
      "dental@1.2.0"
    ],
    "pipeline_version": "1.0.0",
    "degraded": false,
    "partial_reason": null,
    "cost_usd": 0.0141,
    "tokens": {
      "input": 2318,
      "output": 1904
    }
  },
  "document": {
    "plan_name": {
      "value": "Anthem Select (HMO)",
      "status": "found",
      "confidence": 0.98,
      "source": "merged",
      "evidence": {
        "quote": "2024 Evidence of Coverage for Anthem Select (HMO)",
        "start": 4,
        "end": 53,
        "page": 115
      }
    },
    "plan_year": {
      "value": 2024,
      "status": "found",
      "confidence": 0.99,
      "source": "deterministic",
      "evidence": {
        "quote": "2024 Evidence of Coverage for Anthem Select (HMO)",
        "start": 4,
        "end": 53,
        "page": 115
      }
    },
    "issuer": {
      "value": null,
      "status": "not_stated",
      "confidence": null,
      "source": "deterministic",
      "evidence": null,
      "notes": "Carrier name is not stated independently of the plan name in this excerpt."
    },
    "document_type": {
      "value": "evidence_of_coverage",
      "status": "found",
      "confidence": 0.97,
      "source": "deterministic",
      "evidence": {
        "quote": "Evidence of Coverage",
        "start": 9,
        "end": 29,
        "page": 115
      }
    },
    "form_id": {
      "value": "HMO-MAPD 1054638MUSENMUB_0102_R",
      "status": "found",
      "confidence": 0.9,
      "source": "deterministic",
      "evidence": {
        "quote": "HMO-MAPD 1054638MUSENMUB_0102_R Revised 10/06/2023",
        "start": 122,
        "end": 172,
        "page": 115
      }
    },
    "source_pages": [
      115,
      116
    ],
    "truncated": true,
    "char_count_normalized": 4564
  },
  "packages": [
    {
      "package_id": "pkg_1",
      "ordinal": 1,
      "name": {
        "value": "Optional supplemental package 1 - Preventive dental package",
        "status": "found",
        "confidence": 0.99,
        "source": "deterministic",
        "evidence": {
          "quote": "Optional supplemental package 1 - Preventive dental package",
          "start": 691,
          "end": 750,
          "page": 115
        }
      },
      "benefit_domains": [
        "dental"
      ],
      "premium": {
        "value": {
          "amount_usd": 13.0,
          "cadence": "monthly",
          "currency": "USD"
        },
        "status": "found",
        "confidence": 0.99,
        "source": "merged",
        "evidence": {
          "quote": "Premium $13.00 monthly premium",
          "start": 961,
          "end": 991,
          "page": 115
        }
      },
      "benefit_maximum": {
        "value": {
          "amount_usd": 500,
          "period": "per_year",
          "applies_to": "preventive dental benefits",
          "currency": "USD"
        },
        "status": "found",
        "confidence": 0.96,
        "source": "merged",
        "evidence": {
          "quote": "The plan will pay up to $500 for preventive dental benefits each year (benefit maximum).",
          "start": 1849,
          "end": 1937,
          "page": 115
        }
      },
      "network_restriction": {
        "value": "LIBERTY Dental providers only",
        "status": "found",
        "confidence": 0.95,
        "source": "merged",
        "evidence": {
          "quote": "Coverage is available from LIBERTY Dental providers only.",
          "start": 1938,
          "end": 1995,
          "page": 115
        }
      },
      "services": [
        {
          "service_id": "pkg_1.svc_oral_exams",
          "name": "Oral exams",
          "category": "diagnostic",
          "limit": {
            "count": 2,
            "unit": "exam",
            "period": "per_year",
            "raw": "Two oral exams each year"
          },
          "codes": [
            "D0120",
            "D0140",
            "D0150",
            "D0160",
            "D0170",
            "D0180"
          ],
          "status": "found",
          "confidence": 0.95,
          "source": "merged",
          "evidence": {
            "quote": "Two oral exams each year (from the following codes):",
            "start": 1105,
            "end": 1157,
            "page": 115
          }
        },
        {
          "service_id": "pkg_1.svc_xrays",
          "name": "Dental X-rays",
          "category": "diagnostic",
          "limit": {
            "count": null,
            "unit": "study",
            "period": "per_year",
            "raw": "one full-mouth or panoramic X-ray and one set/series of bitewing X-rays each year and up to seven periapical images per calendar year"
          },
          "codes": [
            "D0210",
            "D0220",
            "D0230",
            "D0270",
            "D0272",
            "D0274",
            "D0277",
            "D0330"
          ],
          "status": "found",
          "confidence": 0.88,
          "source": "llm",
          "evidence": {
            "quote": "Dental X-rays include one full-mouth or panoramic X-ray and one set/series of bitewing X-rays each year and up to seven periapical images per calendar year.",
            "start": 1506,
            "end": 1662,
            "page": 115
          },
          "notes": "Compound limit: three distinct quantities in one sentence; modelled as raw text plus per-code list rather than a single count. Bitewing/panoramic codes continue on page 116."
        },
        {
          "service_id": "pkg_1.svc_cleanings",
          "name": "Cleanings (prophylaxis)",
          "category": "preventive",
          "limit": {
            "count": 2,
            "unit": "cleaning",
            "period": "per_year",
            "raw": "Two cleanings per year"
          },
          "codes": [
            "D1110"
          ],
          "status": "found",
          "confidence": 0.97,
          "source": "merged",
          "evidence": {
            "quote": "Two cleanings per year",
            "start": 2931,
            "end": 2953,
            "page": 116
          }
        },
        {
          "service_id": "pkg_1.svc_fluoride",
          "name": "Fluoride treatments",
          "category": "preventive",
          "limit": {
            "count": 2,
            "unit": "treatment",
            "period": "per_year",
            "raw": "Two fluoride treatments per year"
          },
          "codes": [
            "D1208"
          ],
          "status": "found",
          "confidence": 0.97,
          "source": "merged",
          "evidence": {
            "quote": "Two fluoride treatments per year",
            "start": 2984,
            "end": 3016,
            "page": 116
          }
        }
      ],
      "codes": [
        {
          "code": "D0120",
          "code_system": "CDT",
          "description": "Periodic oral evaluation - established patient",
          "evidence": {
            "quote": "D0120 - Periodic oral evaluation - established patient",
            "start": 1160,
            "end": 1214,
            "page": 115
          }
        },
        {
          "code": "D0140",
          "code_system": "CDT",
          "description": "Limited oral evaluation - problem focused",
          "evidence": {
            "quote": "D0140 - Limited oral evaluation - problem focused",
            "start": 1217,
            "end": 1266,
            "page": 115
          }
        },
        {
          "code": "D0150",
          "code_system": "CDT",
          "description": "Comprehensive oral evaluation - new or established patient",
          "evidence": {
            "quote": "D0150 - Comprehensive oral evaluation - new or established patient",
            "start": 1269,
            "end": 1335,
            "page": 115
          }
        },
        {
          "code": "D0160",
          "code_system": "CDT",
          "description": "Extensive oral exam problem focused",
          "evidence": {
            "quote": "D0160 - Extensive oral exam problem focused",
            "start": 1338,
            "end": 1381,
            "page": 115
          }
        },
        {
          "code": "D0170",
          "code_system": "CDT",
          "description": "Re-evaluation-limited problem focused",
          "evidence": {
            "quote": "D0170 - Re-evaluation-limited problem focused",
            "start": 1384,
            "end": 1429,
            "page": 115
          }
        },
        {
          "code": "D0180",
          "code_system": "CDT",
          "description": "Comprehensive periodontal evaluation - new or established patient",
          "evidence": {
            "quote": "D0180 - Comprehensive periodontal evaluation - new or established patient",
            "start": 1432,
            "end": 1505,
            "page": 115
          }
        },
        {
          "code": "D0210",
          "code_system": "CDT",
          "description": "Intraoral - complete series (including bitewings)",
          "evidence": {
            "quote": "D0210 - Intraoral - complete series (including bitewings)",
            "start": 1665,
            "end": 1722,
            "page": 115
          }
        },
        {
          "code": "D0220",
          "code_system": "CDT",
          "description": "Intraoral - periapical first radiographic image",
          "evidence": {